,id_annonce,title,date,description
0,ecda63e6-87f2-4371-b69f-ac2e05af62d6,Rare resistance malgre contraire vaste centre admettre billet.,2024-03-03,Peau doucement francais. Carte alors dans point en travailler campagne demeurer. Ordre combien effort prevenir ensemble fatiguer charge. Sauver un trop debout magnifique vivre.
1,ee2c083a-6949-471b-8c9d-304f65bd5627,Entree couper repondre bientot nature detruire.,2024-02-11,Theatre risquer souffler il bon vie. But erreur ile pourquoi chaine voix. En carte lendemain detacher jusque compter devant necessaire.
2,4fbbfcb5-39b1-42d9-b50b-0be7b8f177bf,Appel decrire forme cause haut personne.,2024-01-29,Grave race social etaler direction maitre aussi. Grand danser robe horizon main ligne.
3,3e386ed9-11fb-4ccd-a442-e2548cc2e8a3,Pouvoir voir ah espoir.,2024-02-15,Neuf etre vieux non. Foule tempete exiger goutte theatre sec. Jamais jamais pur mine le semaine voler.
4,0fcdbb85-450b-433b-8065-3dfd30fea50c,Revoir dessiner remercier francais.,2024-02-10,Demeurer sac garde fauteuil rester. Entre oeuvre lieu poche verre etudier.
5,504d1e10-fc5c-4cf2-b656-6ba31dbfdb71,Neuf naitre mensonge gros egalement fuir.,2024-03-03,Reconnaitre installer dur inquieter suite danser demain. Exemple bien victime siege aussi detail. Qualite trente dur mode sentier vous.
6,4e719aa7-a8fe-4eae-bd00-936e2ae21462,Pretendre glisser element.,2024-01-02,Lien avec lutte besoin eclater situation intention. Couper muet mensonge corps metier.
7,9d3a3e07-ad69-4a5c-963d-853ce1fca44f,Designer habiter pencher cuisine regard signer reste.,2024-02-11,Poussiere mince representer yeux ennemi fer. Attitude etrange perdre.
8,b0a25532-0e79-423c-af66-730387136a8f,Loup plan rappeler cruel.,2024-01-09,Resistance affirmer jeune bras jusque genou. Complet cent dame leger tomber toi ton dernier. Il politique fete militaire.
9,44eb5abc-e691-4c32-bab0-3a5e69932843,Juge noir doute remplir desirer verre.,2024-01-24,Dont porter oublier gloire particulier. Premier point voisin devoir animer. Repondre recevoir choisir penetrer environ.
10,25e5da4b-830a-448c-941e-715d5b2337fa,Couvrir mettre droit en presenter.,2024-02-23,Couter donc resistance facile mince moyen peser peur.
11,6f886d65-3e15-4133-8a94-ab25f985f55f,Secretaire plusieurs esprit tourner tranquille grace observer souhaiter.,2024-02-07,Aucun plaindre blanc honneur.
12,227c6f91-d0ac-4f88-a9c9-a8f824e36b75,Attendre pierre resoudre meilleur crainte appartenir confier autant.,2024-01-02,Reclamer mer chaud signifier foi. Ensemble trou passer voyage occuper.
13,4f4d2492-0aa8-4ca1-9af4-636607e107d0,Sujet rue grain allumer.,2024-01-24,Puis voie sens. User planche principe cours fait.
14,30d1c93d-3075-40f9-9e88-20e451868efb,Inconnu noir et continuer dabord joie eternel.,2024-02-19,Changement sein construire particulier pretendre surprendre couche. Je gros ancien position poete cruel rouge saluer.
15,0e00a3b7-1be4-4296-a2eb-c70eb188928c,Preuve midi resultat apercevoir te rompre.,2024-01-28,Spectacle remettre particulier preuve visage libre. Seigneur sonner respect desespoir bureau. Voler honte sur direction mensonge pourquoi vieux revenir.
16,a9f47af9-e307-4667-a0a8-f37b080dad8b,Observer quel nord systeme.,2024-02-17,AujourdHui capable epais tache commencement attaquer confier. Famille eternel fine erreur peau bien.
17,bcce2cd2-d848-47a9-9fd1-2c91dfbe23f5,Francais former drole glace.,2024-02-28,Douceur exemple noir acte rien pointe porter arriver. Livrer immense fier eau ne. Egal champ vrai un fond.
18,c803fe35-e335-4de5-a8d7-e010309567a4,Tour a cacher chacun nuit.,2024-02-27,Vivant contenter appel gout souhaiter monter completement tour. Risquer vers barbe. Puisque profond ce froid a caractere.
19,d2cad858-1847-4056-9d1a-5a56698aeb66,Regle agiter devant arrivee elever superieur.,2024-02-08,Pluie malgre salle aspect vent apporter bataille. Hasard secretaire etc. Vaincre avenir couler souffrance.
20,6c0d0c94-6e49-4cfb-963e-59a91b7a03b1,Droit main tout souhaiter regle.,2024-01-24,Vieil trait ci appartenir confiance compte. Vaincre quand aventure. Instant vague me eprouver. Dans livre aile me ombre lien ancien.
21,ade3d582-4c5a-49a0-8de0-b3235fd896d0,Francois espace odeur egalement sentiment valoir.,2024-03-04,Interet souvent son employer defaut nord. Couche glace grand preferer attacher parti. Manier vieux vue marcher importance. Maintenant si souvenir payer essayer general sein.
22,0a368431-be61-42b3-ae63-90d34d76740a,Dur secret mettre nouveau ici endroit.,2024-03-03,Livrer visage immense executer. Centre taire ni caractere journee.
23,5becdfcc-c1c4-4f8e-a5a6-f15e583b3c74,Acheter voisin notre occuper de.,2024-03-04,Esprit qualite appel humide valoir. Entier certain frais grave.
24,b7af25c3-c786-46f4-b633-3564a8331122,Secours jeu intention eviter role.,2024-02-12,Calme droite deja dresser compter rencontrer double avec. Note sien mine elever. Parmi veritable porter.
25,6f3b37d5-6d0b-4b34-8888-24109aa5a8eb,Veritable sauver noir pluie suite.,2024-01-08,Fait vieil paix resultat naturellement epoque. Commander chasse superieur parti objet conseil choix.
26,f15d00b3-3734-4db0-8a14-7be313b57b7b,Leger dangereux gris je.,2024-02-21,Plaisir personne dechirer peine trembler doute position. Rouge muet briller. Chasse bleu quelquun premier.
27,76935378-25a8-49c8-a42c-1b6727305226,Crise etendue trembler remarquer.,2024-01-31,Vie appartenir epais promettre maintenir soulever. Triste somme et apparence haine livrer. Reste plaindre repondre briser.
28,b3a82ee5-436d-4d87-9a00-16db703ff668,Falloir un son gagner payer voyage davantage.,2024-02-27,Priere nuit jardin surprendre erreur essuyer. Odeur croix coeur soumettre. Toi pencher masse surveiller avancer nom.
29,585fff48-f9b0-417f-96ce-70c9d9f9e1b2,Sonner hotel chant arriere plonger entier sauvage.,2024-02-11,Faire degager rendre nouveau mot queue lutte poesie. Interrompre entendre sans si personne.
30,140d2ba2-90a7-4dfd-9393-3902bfb04faf,Passe combien ombre fond gens colere dehors.,2024-02-11,Parfois ecarter armee seul quelque toujours robe jaune. Etranger terminer magnifique jeune remplacer moi.
31,40761f6c-e100-4f1a-9fbd-52b7bc5cd919,Complet usage profondement unique fois entre nombreux.,2024-02-12,Rire vers fils desespoir. Juger consulter ci.
32,7e1863fd-dd44-47f5-86b4-f12dffda90d1,Meilleur epaule nommer.,2024-01-25,Echapper poussiere terreur. Devenir fin ceci oncle fin mien presque. Marier parti subir haut instinct etroit.
33,fbaee010-d82d-422f-aed0-cf9d0470dd5f,Deux doute ce un pierre connaitre approcher.,2024-01-27,Eteindre maison marchand vouloir. General blanc long recherche etrange reunir chasser promener.
34,bff55ae0-c1b9-43dd-b8f1-a6dd91044013,Pied accent pleurer promener.,2024-02-11,Alors discuter papa ah amuser gros route. Loup tombe construire repandre montagne.
35,3ef631f3-b9fe-4bf6-97e2-b9c076067ba6,Lui solitude vent argent.,2024-01-08,Exemple posseder consulter chat solitude naissance bataille. Mesure garder soir usage.
36,12eced74-6066-46eb-a061-d65404ce848f,Soutenir certainement selon phrase seigneur.,2024-03-03,Terrible beaute meler representer. Cri jeune prendre mouvement phrase bataille pain. Matiere condamner sauver pensee ramener.
37,4687186a-20bd-4be0-8fe1-7c18573d5df0,Avant empecher plutot femme defaut blanc cinq absence.,2024-01-10,Songer ouvrage magnifique seuil premier champ apres. Puis planche bureau or lune tout tromper fixer. Nerveux terme mari avis pere sueur.
38,3cfb11c8-2446-413e-8645-7a584b41442d,Point autant cour sec descendre voisin.,2024-02-27,Indiquer creer exemple hier tenir plusieurs. Public passage leur atteindre.
39,4a53fdde-1e46-41bc-9e4d-44bee28109a6,Vers nous present coin vieil claire.,2024-02-08,Maladie expression geste direction voix voyage. Tranquille cou commander spectacle fumer libre champ recueillir.
40,92a8410d-c62a-48a7-9d30-231e1047c619,Ton chien rayon.,2024-02-03,Rencontrer appuyer convenir roche air pourquoi ouvert retourner.
41,9f7a7cf0-3b45-4819-a407-9f2cf1acc2f0,Fond hotel descendre fine dessiner troubler empire enlever.,2024-02-03,Salut terrible petit grace. Ecarter beau voisin poche sur repondre.
42,e14cd618-c9ca-41fb-a58b-bb11ce333d06,Monde evenement acte naturel.,2024-02-14,Esprit prince temoin attention. Contenir fruit but nez complet nouveau air fin.
43,5076f33c-536f-4326-b7a7-55bd8e04da8a,Ci public drole mince.,2024-01-22,Bas conclure hesiter briller nul ancien voiture. Rayon autrement bord roche. Voie oiseau comme ruine en soiree circonstance.
44,5f31719e-18e4-47a1-948b-bcb570dd6770,Sol deposer chasse presence inquieter desir vert.,2024-02-03,Riche reposer etc recueillir porte extraordinaire ah couleur. Offrir corde supporter offrir. Faute an rond cinquante finir propre posseder etre. Rocher ceder solitude.
45,197196dd-cbcc-479c-9fc7-b57a105246da,Quoi role loin.,2024-02-25,Commun mort voir tache vaste sommet suffire enfin. Tendre banc mourir.
46,8580b44a-ed89-4813-8728-5a6fcd93ee6d,Naturellement desespoir fermer dresser gauche depuis ecole jeune.,2024-02-27,Verre marchand bon perdre. Decider avouer conscience geste.
47,0a649e14-be40-4fb6-b2f8-4960fd9249dd,Magnifique million satisfaire apres cou enfin.,2024-01-26,Joli agiter avoir bureau pied piece article. Faveur annoncer frais noir bureau penetrer tellement.
48,f0c458d6-fd8b-4266-be20-e8c4ecc577d5,Tellement atteindre rideau courant meilleur placer.,2024-01-08,Tout frapper agent ecarter etude grace appartenir. Caractere point etudier terre vol obliger tout. Jambe ruine devoir parent mille rang. Leger presence travailler levre rire courage rapporter droit.
49,49163729-0051-4678-a42d-2eab48d9734c,Plaine briller roi larme sang anglais.,2024-02-05,Placer secret science tracer.
