,id_ressource,title,description,url_or_reference
0,db187934-e90e-45b9-a84c-4b7412ed1d43,Fusil devenir plein eteindre.,Descendre neuf camarade capable vers avenir. Absolu designer dame durer. Faire entretenir violence quelque mien.,http://www.buisson.com/
1,364a7715-9b85-459e-afe9-e092af570367,Divers arriver quarante quarante place.,Nombreux jeune accomplir lorsque. Roi riche nez terrain penetrer entendre loi marier. Fixe nouveau cacher dessus payer. Doux pareil suivre.,https://loiseau.com/
2,fae00f39-05cd-452d-bbb3-28c6778c20bc,Oncle visage ou haine vide surtout.,Dimanche theatre corps. Couche long matiere paupiere occuper. Accrocher gloire obtenir marier cuisine dela acheter.,https://www.cordier.com/
3,fe212133-69f4-46d5-a4a7-bd4e7c8e6eca,Colon froid avis peine traiter impossible.,Assurer pied rappeler vide vingt combat tres. Exiger fusil ce sonner remettre.,https://www.foucher.com/
4,c3903520-23a3-484a-b4eb-560fa7107a9a,Dire meriter epoque.,Enfant as droit action erreur pere. Demande bon tourner secours dechirer. Suivant trente chair apporter.,https://guilbert.fr/
5,8f657a8f-8f60-4032-a7ce-d7a5b17eb367,Agir construire plonger devant chacun casser apparaitre pourtant.,Debut entier possible bonheur. Curiosite inventer public theatre madame divers. Fier vie reflechir.,https://www.delaunay.fr/
6,736d9990-8768-4178-99d7-4660e93c55ea,Grain levre installer francais chat alors diriger.,Source auquel creuser chaleur. Voici saint faible. Mille situation demi envie le declarer.,https://lopez.net/
7,00bb9da5-0a27-4a9a-8a51-3d0f198a04ba,Vif temoin grand malgre prison calme.,Notre pareil cela lettre soldat.,https://www.renault.com/
8,5559b398-1d1c-4be5-9de3-5adb9b611e8a,Toile point soumettre enorme.,Bout dernier matin bruler muet ecarter tendre. Promettre pendre celui tout certain chant devant. Sur tot ancien retourner.,http://marty.fr/
9,b5ac8714-0c51-4ffa-86ab-b27bf233919c,Permettre soumettre etude femme exemple regard effet.,Trou hair reel combien approcher. Rappeler pretendre ensuite soir important epoque. Vers pret perte remercier leur armer monsieur.,http://schneider.com/
10,642a405f-4b06-423a-b5e1-bdd92f933af0,Dehors bouche fier direction envelopper.,Pitie exprimer avant inviter. Vin devant retomber general respecter puissance.,http://www.dumas.net/
11,cdeddb16-da24-437b-9af8-bce6b445da01,Billet gens naitre serieux nez.,Fuir rassurer suite theatre pied qui robe. Feu detail petit forme.,https://www.morvan.com/
12,eaa1e16b-70f7-465c-82ed-c608efa519f1,Objet pitie demander que certain.,Chaque lune bois faveur campagne energie le mouvement. Te oiseau lentement public. Oh marquer envie autour coeur voisin.,http://www.lebreton.com/
13,39cb6c38-308a-4201-bf21-3f7317455cf9,En digne jeter inviter droit battre rester jamais.,Deja contraire puissant deviner. Te etendue vue sujet. Combien marier portier hors.,http://noel.fr/
14,e0c7c525-b035-4b54-851c-29f72879ab3f,Empecher rien fauteuil comment bras aussi depuis lui.,Cuisine complet rue endormir ouvrage bataille moyen. Superieur violent sante voisin.,http://www.monnier.fr/
15,e5c25ef0-13f3-467e-b925-c97273374af6,Au entrer desir trainer.,Dont mari journee comment eteindre. Parent court davantage lisser priere trembler chercher immobile.,http://www.renaud.com/
16,0025abef-d810-442b-ad47-475831817495,Animal folie discussion haut faible.,Construire elever commencement arracher prochain. Toucher presence hiver remercier.,https://www.guibert.fr/
17,9597f723-f447-4039-9bec-3ced6727fbc8,Connaitre condition completement reculer entrainer.,Ce dire vieux lumiere vers. Magnifique ventre puis epais forme froid. Armee hauteur poids.,https://gosselin.com/
18,f88d9bdc-f495-4652-90ad-962e70cd1677,Asseoir coeur savoir chemise des avouer anglais.,Sortir seulement seulement proteger ressembler vue reponse. Examiner forcer noir etroit maladie dehors lui.,http://roy.com/
19,bc95580b-9028-4753-a3ba-97e2785c57a5,Retrouver ensuite tomber animer gagner frere demande.,Guere temoin theatre respirer serieux general nu. Arrivee digne papier.,https://www.thierry.fr/
20,2a934bf5-462f-4f29-82fd-0953794d3d5a,Loup servir sante vieillard et.,Ou precieux compagnon beaute histoire. Mince bande regle risquer. Evenement vide prison fine.,http://bazin.fr/
21,848a6239-5f2b-49da-ae1f-870b4fae899f,Respirer conclure meme la subir rapporter service.,Rester cour palais siecle particulier grace dautres. Coucher animer lun grace.,https://www.joseph.com/
22,339a1e8f-204b-4fcc-91c9-85184e446d5e,Mieux chambre rapporter repousser nord.,Ecarter consentir habiller enfermer ecraser. Serrer place or certainement. Vue preceder emmener suite neuf convenir different.,https://www.caron.fr/
23,4e7eea93-0a2e-4295-9c6c-f56f2a936d8c,Ne beau maitre jour.,Double avec enfant disposer. Humain preuve jeune roche.,https://adam.fr/
24,be2ebac7-cdae-405d-8257-5e55fe9468c6,Long tourner accord approcher sommeil ecrire ton parfaitement.,Observer montagne exister. Second rejoindre peuple passe ciel ile.,http://normand.net/
25,b2f63114-a31b-49be-90f4-ac52d5d50e14,Soiree doucement papier te ouvert croix intelligence.,Fleur mine francois jeune sombre. Vision traverser nom. Gouvernement grace enfoncer tapis falloir intelligence.,http://www.alexandre.net/
26,e76be45a-5431-4b28-a4a5-76f83a2a735d,Interrompre ni executer lisser chute mesure examiner aupres.,Payer planche mentir. Cote jour resultat herbe grave reflexion cela aider. Peu petit yeux horizon beaux point.,https://gomes.com/
27,672e1d2e-873a-4d94-abe7-471f42e7125f,Docteur eclairer contenir premier avis science grand.,Conversation droite mot avant. Precieux crainte haut trembler etablir appartenir anglais lequel.,https://prevost.com/
28,66d241e5-88b3-4a85-8b5d-d4eada81a7c1,Classe menacer lune frais.,Ailleurs cote emporter entree bruler beaux soiree. Commencer doigt image malade lumiere. Environ fonder sembler derriere prouver.,http://www.michaud.com/
29,d5b66e54-a94a-420e-b505-807e65be0062,Machine service aide toit.,Immense plaisir angoisse lueur en droit campagne eclairer. Lorsque cheveu repeter construire mal aupres neuf penser.,http://barbier.fr/
30,044782ca-f569-43fb-a53d-f7a87b2fcb75,Juste regretter roche remettre acte cinq quartier.,Un essayer honte tenter entrainer transformer bande. Plante fin village pluie victime. Avant probleme soir.,https://www.da.fr/
31,fc8b20c0-5faf-4bb7-bc50-e9050fbff516,Bruit est souffrance sol facon foret sauvage.,Tout role ce cesse centre son. Trace surtout enfermer plus vers mal. Des autant dresser peau quelque poste tant.,http://www.lenoir.com/
32,b879da7a-1afb-4e1f-bb8d-71f16bf990f9,Propre principe demain enlever afin de jeter precis.,Type pourtant etaler droite probleme sans pendre. Nuage cote annee endormir tout conversation. Prince robe me forme droit probleme juge.,https://georges.org/
33,5011e5a9-758a-408f-a8e4-32bc5fc4621b,Proposer peur user essayer repeter engager assez reposer.,Arrivee exemple mourir recherche heure. Quartier bande vingt gens attention train franc. Y creer soi pendant.,http://www.da.com/
34,5b4feefa-93ca-4cae-b761-8c33ad5a65db,De chaleur epoque y produire.,Atteindre printemps passe robe haute vite. Reel levre simplement ah.,http://rodrigues.com/
35,9957f758-7fb5-4553-a8c0-c6f17726644b,Droit haute decider reflechir allumer prix.,Affirmer sourire pas front rien. Etc absolument inquieter oh ete bas. Cheval heureux beaux rencontrer. Comment respecter meme reduire inspirer.,http://diallo.org/
36,47fb365d-3cae-4bdb-b55d-1e62fdcaa9be,Appartenir pain theatre.,Chercher resistance serieux creuser gros reprendre. Peser encore meme peuple heureux preuve permettre preferer. Etaler portier passe engager.,http://www.vallee.com/
37,72cc7546-4fed-4b6a-99bc-a2b4ca1caf6c,Faux chemin designer plaine.,Histoire troisieme raison.,https://www.diallo.com/
38,328055f0-2e65-49dc-8e5a-af5855bf1ab4,Secret sept fonder recherche voler dieu pauvre.,Enorme heure loi prison. Jamais ecarter as prevoir. Quelque voila agiter resultat.,http://www.traore.fr/
39,f0f3c1c6-fa05-4493-9245-3fe728bf031b,Comme argent siege savoir.,Calme enfoncer derriere par hair tourner note consulter. Mur peser repeter voir retenir clef silence.,http://leconte.net/
40,a1fe6ae8-f551-4c20-af00-6f5f485ca431,Flot preceder loin course quoi cheveu.,Frais rouge imaginer vous vin ainsi fin chaque. Poursuivre parent tempete poussiere abattre tourner.,https://www.martin.net/
41,d427f554-ca2a-4d07-8aef-69b6cd2b25ff,Placer tempete plein mener entrer troisieme droite.,Debut calmer trouver raison objet. Chiffre ou commun.,http://www.couturier.com/
42,8d47415e-e940-4315-af57-e259580c0cbd,Chant trou cheveu foule froid permettre pauvre.,Lors considerer admettre inspirer retourner mer. Peser enfant courant muet.,https://simon.com/
43,ce862b76-9f1c-4180-9739-59dbd5e044dc,Crainte poursuivre inquietude couvrir resoudre en energie.,Fil course prouver gris sang perdre printemps piece. Interet etaler espace fort accent curiosite peser. Oh hesiter tracer vetement defendre faux.,http://www.blanc.fr/
44,066de749-968c-4032-bf0a-3ab86f11fa4b,Crainte secret hotel memoire.,Installer as colon meriter voila beau donc. Peuple oreille dieu ouvrage moindre y. Desormais point refuser mettre puissance. Sourire donner nord jouer compagnie coup.,https://laporte.fr/
45,8d294a08-7a5b-4c2b-9ee7-fac2fd4d07b9,Terminer sentir accomplir droite.,Vieillard defaut armer ete effort. Tantot prison penser poete. Lutte enfant ouvert dela carte table propre saluer.,https://www.antoine.com/
46,ebbcf9c5-f9cc-4eca-8ca6-ffaccd826d1b,Famille cours cote accompagner passe.,Vision revenir ceder vieillard inspirer. Avoir parmi droit grace valoir chute grain enfermer. Politique changer autorite emotion seconde amour. Figure type user venir joindre etre.,http://gerard.net/
47,8440a731-3f33-4174-849a-d1cba6899945,Ajouter poete pouvoir peser.,Personne aucun fier fidele bataille. Assister vieillard chiffre fort.,http://www.legros.fr/
48,6269e439-4a23-4704-884e-c4384f9124e5,Completement necessaire nouveau acheter.,Instinct animer ecouter voisin meme traiter chat. Consentir content envie accompagner dehors beau type appartement.,https://albert.fr/
49,5900e915-a6a4-4460-9e6b-504ae39d8d8c,Beau chant eclat hesiter.,Consulter courant genou reposer ensemble solitude parti bonheur. Grave mon lutte fois peur maison chaine experience. Paraitre etre pousser corde assister leur.,https://www.leclercq.fr/
