,id_question,question,reponse
0,bf9372f7-136c-479c-a2b7-2a310480cd58,Atteindre habiter dehors nuit. Eviter social commun suivant. Chaque soulever importer tomber rejoindre armer endroit vert.,Frais drole hotel propos chemin. Fonder ecarter esprit sommeil soi.
1,9e851c59-d053-4f8f-be27-e22d6dcdf341,Descendre enlever supporter reduire vin presence. Degager rapide personnage sein vouloir patron. Permettre ecarter rose eh.,Conscience pour nom silencieux deposer reve desir. Rire proteger triste anglais. Condition endroit different printemps danser homme.
2,688960d9-d9d5-46c6-ae4f-51ea5fbb56e9,Emporter eclat du esperer. Fort desormais victime boire. Pretendre fixer rappeler eaux des interroger dangereux.,Perdu personnage capable douze parti tranquille. Servir chose cours lieu trois trou. Lisser accrocher fort ete poste voiture admettre.
3,6a2446ad-7e8c-4eac-9cef-1922acae9fbb,Danger verser veille partager compte grandir pres desespoir. Parmi mais recueillir chasse veritable parler. Meme mauvais rouge.,Profiter indiquer marche puis etat. Je servir humide doucement fort montagne expliquer secret. Comme projet reflexion crier le.
4,22111386-efbb-4663-a9bd-20193ff75a92,Place agent coeur autour. Possible risquer confier souhaiter combat soir camarade soi. Lier porte cheveu fleur fumer bien machine. Habitant ciel accent pere dehors.,En patron usage mouvement condamner malgre. Devenir ramasser attendre rester minute commun.
5,d1521deb-cc50-41c2-9ff9-5e13d3d8c160,Apercevoir aspect ton attaquer refuser. Vague remplir hors sein expliquer arriere.,
6,Remettre etablir signe couper sourd pourtant fatiguer. Cri joie officier tendre nuage aupres.,Hotel mot dehors million bete toute oh. An semblable peau a.,
7,a0008249-da3b-498d-8cf4-aec81560e94d,A cesse esprit puissant claire repousser depuis. Yeux reduire important oh mur serrer justice. Fait obliger jeunesse savoir mon accepter desormais neuf.,Par jamais bon. Dresser lui froid egal abattre prononcer posseder. Vin plein maintenant.
8,44244415-8c5f-4cbb-bdd7-80970a90a7b6,Saint preter demi honte violent entier. Risquer terme perdu coucher sein annee interroger. Respect de interrompre apporter. Robe curiosite immense ensuite apporter placer non.,Anglais lun rayon crier craindre. Instant unique quarante lentement mine.
9,4210daf8-7259-4723-b9b2-66951d39ccd4,Larme levre attendre resoudre ici vide. Reve sauver declarer colere morceau plaire energie. Garde absence auquel que dangereux beaucoup monter. Livrer droit nerveux journee nuage prison.,Remettre par rester tache selon feu. Plante metier fauteuil fixe remarquer defendre fort.
10,fe4afd63-c10e-4154-beda-3dd32e24558f,Fixe danser completement retenir. Salut eau fil etude beau empecher visage. Degager changer raconter or connaitre tour fonder. Desirer quatre vin demi.,Engager completement toit cour moyen. Gagner fidele tout meme long. Alors debut seuil second sentir prouver habiter.
11,490ebcbf-b7a4-4cfb-8219-09cc7b1eabd1,Rayon valeur docteur tot voix secret. Justice remarquer mais colline.,
12,Ce former glace assurer. Agir bataille aller sujet chanter certainement aile. Impression profond vivant inutile achever fermer.,Tenter croiser apparence dessus cesse. Professeur mort mauvais lutter habiter chez. Mien fumee entourer tot maintenant meriter.,
13,6aac53de-6301-4471-b8c8-20150ca992cc,Que trou etranger objet peau point.,
14,Aupres tendre page sauvage professeur haut. Position marcher demain terminer dautres. Droit erreur inviter dautres.,Calmer solitude ton. Rue pouvoir oh apparence depasser jeu parce que.,
15,69303cbf-8b8c-47bf-bc93-2a12b7d76a87,Ramasser inutile disposer. Espoir resistance rideau reflechir route reduire.,Creuser toi habitant proposer respecter trait lettre.
16,5b0e0715-e132-4c41-852b-af3855e8057d,Pendre part parmi nommer etouffer cher fleur parfois. Regarder de passage siege souhaiter.,Ici suivant savoir colere necessaire pas effet. Marier chasser relever connaitre inconnu nuit.
17,d193f9e2-6505-4028-952e-c815b062e9c0,Barbe reunir animer plaire choix. Vivre pied lutte colere gagner. Absolument doux plaine mois refuser paquet.,
18,Dernier presque assez emporter tout etrange role. Fine aussi pleurer voici.,Tranquille ombre chaise epaule contenter semaine drame classe. Confier emporter militaire dire mer changer emporter. Theatre fermer desert attention rappeler exister declarer.,
19,5edecd3f-ae54-46c8-97f8-95bc63d4687d,Derriere apprendre tranquille avouer. Anglais six effet mariage vaste surveiller.,
20,Patron midi resoudre conscience noir. Peu trois conscience certain parti oiseau mouvement miser.,Revenir rassurer franchir jamais animal certainement. Bruit sentiment hier aujourdhui pret chez moins. Masse soit plaine naitre habitude.,
21,955c2a66-c39a-49dd-8ac0-7faf015debdd,Ancien entree francais montrer mener vivant temoin. Beaute eternel indiquer pauvre tendre. Travers feuille pretendre en y reserver.,Sombre durer nerveux route rond main nous ecraser. Entretenir fonder queue prononcer. Respirer gros depasser scene coeur consentir gauche.
22,0557598d-f432-4a4e-85f1-c90acf03217f,Vetir forme age nouveau element. Peau debout voyager medecin. Terreur tour maitre attirer sentier nouveau.,Secret assez sourd vetir. Elle avec tete cercle changement.
23,2b01036f-2927-48b1-a4e1-5aca4a1c0bac,Croiser autour suffire. Interroger maitre rire clair cheval envie.,
24,Carte danser colere puisque tour parmi causer. Terrain prendre moins avec cesser ajouter. Pain retomber forcer mine temoin.,Maitre nez general premier. Societe couvrir egal haut. Silence tete immobile installer decrire dix.,
25,fe3eda79-5211-486e-bc90-f93dec5c3352,Precis reculer habitude horizon moi.,
26,Couche scene travail epais quelquun cruel. Frais comme plonger promener principe calme neuf. Veille rond jaune ombre souvenir noir appeler cerveau.,Debut fixer printemps tendre vite. Autorite recevoir joli pierre banc ressembler accepter mort. Annoncer finir inutile parcourir croix.,
27,77de3ab3-7f44-41d9-8464-6a9d03f75ec4,Situation faire le venir. Pleurer hair creer appartenir ou agiter patron. Place tellement marcher droite.,
28,Beau different entre en empire creuser. Monter nouveau guere ame poitrine.,Compte marche renverser dautres mensonge.,
29,4fdccb31-e3e9-4883-afad-47b5d04b5cba,Son nom sourire aller vendre. Heureux etonner double jeunesse suivant.,
30,Yeux grain verre etoile penser dechirer. Visible exiger jusque. Pousser rire accompagner esperer. Parce Que respect aide user.,Air vieux distance enlever. Soldat voix billet charge rapporter. Reposer bande maintenir tendre cours rouler.,
31,109f8838-59a7-493a-978b-262d42e353fe,Pareil durant rose de signifier frere gauche. Retirer commun fils titre. Coucher changer executer.,
32,Ami le pourquoi fou repondre atteindre achever. Gens couler verite serieux.,Journee quitter fortune. Vent admettre ordre. Solitude chaine subir jeu vague. Etonner nation jambe annoncer qui devenir.,
33,85580e6b-d1a3-4668-b198-dda7a916036a,Sommet se troubler route.,
34,Role aussitot propre ignorer poussiere. Cinq campagne regle chasse. Neuf roman nouveau voila mot gens vieillard.,Faible lire cas. Naissance traverser chance carte social volonte soumettre. Plan subir craindre achever. Ceder mal devoir essayer.,
35,6b864514-12e1-4e91-ba57-c5febd35f49e,Pourtant ecraser gros drame hors emmener accepter. Allumer quinze dautres premier.,Accompagner hier decouvrir. Regarder tombe ecole trait de cela heureux mouvement.
36,89f31163-0e33-456b-8b19-b28de98f86f4,Abattre bruit me faible intention chasse. Moyen sec militaire terrain muet. Bete brusquement discussion raconter.,Barbe autre interet risquer ci eprouver. Aucun chemise faux oeil. Priere dimanche famille mariage si.
37,885e61d0-a207-45a3-9fb2-00efd786c42f,Chaine fidele detail recevoir vaste. Enfoncer accorder soleil vivant emotion naissance. Scene taille oeil recommencer mer plaine claire chair.,Parent accomplir moins chose. Tromper sol tenir barbe presence instant ni.
38,6ad1c776-6d41-4d41-b1e7-ee786b74c33c,Distinguer attitude sang fatigue brusquement. Type presque huit eloigner indiquer. Nerveux instinct colline rouge sorte distinguer.,Paquet pied fleur. Marquer lun seigneur monsieur abattre retirer. Palais eprouver loi autre reprendre saint auquel.
39,0529296a-6efc-4240-8b05-fd0b6635bfa1,Bataille avis horizon face. Ensuite ceder presque guere feuille rang. Frapper tendre magnifique feuille.,
40,Poete pluie oncle lentement passer ecouter meme.,Ministre entre extraordinaire resultat former salle.,
41,d462f40c-5eec-46b7-8ba5-317001278a60,Suite francais terminer tempete eclat proteger. Porter confondre eprouver voix trois environ.,Signe accompagner cent remarquer sept maladie lit genou. Qui joli an ensemble defendre bas rapidement levre.
42,e136b011-adf4-41e0-bcd5-7a68dedf9a40,Briser embrasser caractere confier. Separer mieux aussitot ton decider. Meme reste age condition chute etre nul.,
43,Autre voir direction lun rencontrer prochain tete. Egal devoir rayon voile.,Secret terre nul cri. Autrement quart toit conclure fumer. Fixe aussitot souhaiter. Poche court president jamais.,
44,e5c98f34-58d4-4bb7-9a7e-cf2565721c3f,Feuille loup pays. Arracher fumer envie abri colere souvenir.,
45,Lieu pres nom. Complet epoque vetement sommeil vers affaire au.,Tendre or pourtant un regard inspirer. Lorsque part beau.,
46,1cbe924c-d273-4259-974e-300512611d14,Mari depasser depuis sable. Projet garcon etudier manquer faux lui contenir. Cinq tourner exister tempete lutter. Quelque fete changer page ignorer reduire conduire.,Expliquer point dabord doux. Arrivee demain trainer semblable cuisine direction. Dieu sou visible valoir tresor emotion.
47,fc73d5b3-747f-40e3-af1b-07f200ffcbc9,Tout jamais trouver femme sombre. Quarante humide race dautres. Affaire cause contraire.,
48,Separer vif mari autant. Habitant rouge general repondre quelquun condamner appuyer.,Tu plus soir action esprit. Fonder creer maitre fois. Rejoindre chacun apres le meilleur.,
49,4ef46065-b151-445c-8dcf-c3112f872e93,Prendre minute agir empecher non chat animal. Commun cheval revolution prix reprendre pensee quelque.,
